{
  "attributes": [["position", "uv", "normal"]],
  "stepModes": ["vertex"],
  "primitive": {
    "cullMode": "back",
    "frontFace": "ccw",
    "topology": "triangle-list"
  },
  "vertices": [
    [
      -1.0, 1.0, 0.0, 0.0, 0.0, 0.0, 0.0, -1.0, -1.0, -1.0, 0.0, 0.0, 1.0, 0.0,
      0.0, -1.0, 1.0, -1.0, 0.0, 1.0, 1.0, 0.0, 0.0, -1.0, 1.0, 1.0, 0.0, 1.0,
      0.0, 0.0, 0.0, -1.0
    ]
  ],
  "indices": [0, 1, 2, 0, 2, 3]
}
